=== Fast Downward Experiment Log ===
Domain: darksouls-fd
Planner: lama (seq-sat-lama-2011)
Problem: problem.pddl
Time Limit: 1800 seconds
Start Time: 2025-12-16 11:43:13
Domain File: .//darksouls-fd/domain.pddl
Problem File: .//darksouls-fd/problem.pddl

=== Fast Downward Output ===
INFO     planner time limit: None
INFO     planner memory limit: None

INFO     Running translator.
INFO     translator stdin: None
INFO     translator time limit: None
INFO     translator memory limit: None
INFO     translator command line string: /opt/homebrew/opt/python@3.14/bin/python3.14 -m translate darksouls-fd/domain.pddl darksouls-fd/problem.pddl --sas-file output.sas
Parsing...
Parsing: [0.000s CPU, 0.003s wall-clock]
Normalizing task... [0.000s CPU, 0.000s wall-clock]
Instantiating...
Generating Datalog program... [0.000s CPU, 0.000s wall-clock]
Normalizing Datalog program...
Unbound effect variables: Adding @object predicate.
Normalizing Datalog program: [0.010s CPU, 0.001s wall-clock]
Preparing model... [0.000s CPU, 0.001s wall-clock]
Generated 130 rules.
Computing model... [0.000s CPU, 0.003s wall-clock]
759 relevant atoms
612 auxiliary atoms
1371 final queue length
2188 total queue pushes
Completing instantiation... [0.010s CPU, 0.008s wall-clock]
Instantiating: [0.020s CPU, 0.013s wall-clock]
Computing fact groups...
Finding invariants...
47 initial candidates
Finding invariants: [0.000s CPU, 0.002s wall-clock]
Checking invariant weight... [0.000s CPU, 0.000s wall-clock]
Instantiating groups... [0.000s CPU, 0.000s wall-clock]
Collecting mutex groups... [0.000s CPU, 0.000s wall-clock]
Choosing groups...
82 uncovered facts
Choosing groups: [0.000s CPU, 0.000s wall-clock]
Building translation key... [0.000s CPU, 0.000s wall-clock]
Computing fact groups: [0.000s CPU, 0.003s wall-clock]
Building STRIPS to SAS dictionary... [0.000s CPU, 0.000s wall-clock]
Building dictionary for full mutex groups... [0.000s CPU, 0.000s wall-clock]
Building mutex information...
Building mutex information: [0.000s CPU, 0.000s wall-clock]
Translating task...
Processing axioms...
Simplifying axioms... [0.000s CPU, 0.000s wall-clock]
Translator axioms removed by simplifying: 0
Processing axioms: [0.000s CPU, 0.001s wall-clock]
Translating task: [0.050s CPU, 0.055s wall-clock]
1053 effect conditions simplified
0 implied preconditions added
Detecting unreachable propositions...
6 operators removed
0 axioms removed
114 propositions removed
Detecting unreachable propositions: [0.010s CPU, 0.011s wall-clock]
Reordering and filtering variables...
38 of 38 variables necessary.
0 of 13 mutex groups necessary.
324 of 324 operators necessary.
0 of 0 axiom rules necessary.
Reordering and filtering variables: [0.010s CPU, 0.007s wall-clock]
Translator variables: 38
Translator derived variables: 0
Translator facts: 101
Translator goal facts: 2
Translator mutex groups: 0
Translator total mutex groups size: 0
Translator operators: 324
Translator axioms: 0
Translator task size: 21002
warning: could not determine peak memory
Writing output... [0.010s CPU, 0.007s wall-clock]
Done! [0.100s CPU, 0.099s wall-clock]
b"Warning: name clash between type and predicate 'boss-phase'.\nInterpreting as predicate in conditions.\nWarning: name clash between type and predicate 'player-level'.\nInterpreting as predicate in conditions.\n"
translate exit code: 0

INFO     Running search (release).
INFO     search stdin: output.sas
INFO     search time limit: 1800s
INFO     search memory limit: None
INFO     search command line string: /Users/vramos/Master_uc3m/PlanifAuto/downward/builds/release/bin/downward --search --if-unit-cost 'let(hlm,landmark_sum(lm_reasonable_orders_hps(lm_rhw()),pref=true),let(hff,ff(),iterated([lazy_greedy([hff,hlm],preferred=[hff,hlm]),lazy_wastar([hff,hlm],preferred=[hff,hlm],w=5),lazy_wastar([hff,hlm],preferred=[hff,hlm],w=3),lazy_wastar([hff,hlm],preferred=[hff,hlm],w=2),lazy_wastar([hff,hlm],preferred=[hff,hlm],w=1)],repeat_last=true,continue_on_fail=true)))' --if-non-unit-cost 'let(hlm1,landmark_sum(lm_reasonable_orders_hps(lm_rhw()),transform=adapt_costs(one),pref=true),let(hff1,ff(transform=adapt_costs(one)),let(hlm2,landmark_sum(lm_reasonable_orders_hps(lm_rhw()),transform=adapt_costs(plusone),pref=true),let(hff2,ff(transform=adapt_costs(plusone)),iterated([lazy_greedy([hff1,hlm1],preferred=[hff1,hlm1],cost_type=one,reopen_closed=false),lazy_greedy([hff2,hlm2],preferred=[hff2,hlm2],reopen_closed=false),lazy_wastar([hff2,hlm2],preferred=[hff2,hlm2],w=5),lazy_wastar([hff2,hlm2],preferred=[hff2,hlm2],w=3),lazy_wastar([hff2,hlm2],preferred=[hff2,hlm2],w=2),lazy_wastar([hff2,hlm2],preferred=[hff2,hlm2],w=1)],repeat_last=true,continue_on_fail=true)))))' --always --internal-plan-file sas_plan < output.sas
[t=0.000166s, 435303760 KB] Search code revision: 505701e0f
[t=0.000175s, 435303760 KB] reading input...
[t=0.005893s, 435303760 KB] done reading input!
[t=0.007129s, 435307856 KB] Initializing landmark sum heuristic...
[t=0.007134s, 435307856 KB] Generating landmark graph...
[t=0.007167s, 435307856 KB] Building a landmark graph with reasonable orders.
[t=0.007197s, 435307856 KB] Initializing Exploration...
[t=0.007701s, 435307856 KB] Generating landmarks using the RPG/SAS+ approach
[t=0.010544s, 435307856 KB] Landmarks generation time: 0.003376s
[t=0.010549s, 435307856 KB] Discovered 31 landmarks, of which 0 are disjunctive and 0 are conjunctive.
[t=0.010552s, 435307856 KB] There are 175 landmark orderings.
[t=0.010555s, 435307856 KB] approx. reasonable orders
[t=0.010634s, 435307856 KB] Landmarks generation time: 0.003499s
[t=0.010637s, 435307856 KB] Discovered 31 landmarks, of which 0 are disjunctive and 0 are conjunctive.
[t=0.010640s, 435307856 KB] There are 181 landmark orderings.
[t=0.010642s, 435307856 KB] Landmark graph generation time: 0.003509s
[t=0.010645s, 435307856 KB] Landmark graph contains 31 landmarks, of which 0 are disjunctive and 0 are conjunctive.
[t=0.010648s, 435307856 KB] Landmark graph contains 181 orderings.
[t=0.011078s, 435307856 KB] Simplifying 5186 unary operators... done! [4706 unary operators]
[t=0.013646s, 435307856 KB] time to simplify: 0.002570s
[t=0.013743s, 435307856 KB] Initializing additive heuristic...
[t=0.013748s, 435307856 KB] Initializing FF heuristic...
[t=0.013810s, 435307856 KB] Building successor generator...done!
[t=0.013893s, 435307856 KB] peak memory difference for successor generator creation: 0 KB
[t=0.013896s, 435307856 KB] time for successor generation creation: 0.000075s
[t=0.013900s, 435307856 KB] Variables: 38
[t=0.013903s, 435307856 KB] FactPairs: 101
[t=0.013905s, 435307856 KB] Bytes per state: 8
[t=0.013949s, 435307856 KB] Building successor generator...done!
[t=0.013955s, 435307856 KB] peak memory difference for successor generator creation: 0 KB
[t=0.013957s, 435307856 KB] time for successor generation creation: 0.000000s
[t=0.013961s, 435307856 KB] Variables: 38
[t=0.013963s, 435307856 KB] FactPairs: 101
[t=0.013966s, 435307856 KB] Bytes per state: 8
[t=0.013974s, 435307856 KB] Starting search: lazy_greedy
[t=0.013977s, 435307856 KB] Conducting lazy best first search, (real) bound = 2147483647
[t=0.014034s, 435307856 KB] New best heuristic value for landmark_sum_heuristic: 22
[t=0.014037s, 435307856 KB] New best heuristic value for ff: 21
[t=0.014040s, 435307856 KB] g=0, 1 evaluated, 0 expanded
[t=0.014046s, 435307856 KB] Initial heuristic value for landmark_sum_heuristic: 22
[t=0.014048s, 435307856 KB] Initial heuristic value for ff: 21
[t=0.014085s, 435307856 KB] New best heuristic value for landmark_sum_heuristic: 21
[t=0.014088s, 435307856 KB] g=1, 2 evaluated, 1 expanded
[t=0.014177s, 435307856 KB] New best heuristic value for ff: 20
[t=0.014180s, 435307856 KB] g=3, 4 evaluated, 3 expanded
[t=0.014225s, 435307856 KB] New best heuristic value for landmark_sum_heuristic: 20
[t=0.014229s, 435307856 KB] New best heuristic value for ff: 19
[t=0.014232s, 435307856 KB] g=4, 5 evaluated, 4 expanded
[t=0.014307s, 435307856 KB] New best heuristic value for landmark_sum_heuristic: 19
[t=0.014309s, 435307856 KB] g=5, 7 evaluated, 6 expanded
[t=0.014341s, 435307856 KB] New best heuristic value for landmark_sum_heuristic: 18
[t=0.014353s, 435307856 KB] New best heuristic value for ff: 18
[t=0.014355s, 435307856 KB] g=6, 8 evaluated, 7 expanded
[t=0.014400s, 435307856 KB] New best heuristic value for landmark_sum_heuristic: 17
[t=0.014403s, 435307856 KB] New best heuristic value for ff: 17
[t=0.014406s, 435307856 KB] g=7, 10 evaluated, 8 expanded
[t=0.014558s, 435307856 KB] New best heuristic value for landmark_sum_heuristic: 16
[t=0.014561s, 435307856 KB] New best heuristic value for ff: 16
[t=0.014563s, 435307856 KB] g=9, 14 evaluated, 11 expanded
[t=0.014653s, 435307856 KB] New best heuristic value for landmark_sum_heuristic: 15
[t=0.014656s, 435307856 KB] g=10, 17 evaluated, 14 expanded
[t=0.014684s, 435307856 KB] New best heuristic value for landmark_sum_heuristic: 14
[t=0.014686s, 435307856 KB] New best heuristic value for ff: 15
[t=0.014689s, 435307856 KB] g=11, 18 evaluated, 15 expanded
[t=0.016918s, 435307856 KB] New best heuristic value for landmark_sum_heuristic: 13
[t=0.016921s, 435307856 KB] New best heuristic value for ff: 14
[t=0.016924s, 435307856 KB] g=13, 113 evaluated, 88 expanded
[t=0.016955s, 435307856 KB] New best heuristic value for landmark_sum_heuristic: 12
[t=0.016957s, 435307856 KB] New best heuristic value for ff: 13
[t=0.016959s, 435307856 KB] g=14, 114 evaluated, 89 expanded
[t=0.016996s, 435307856 KB] New best heuristic value for ff: 12
[t=0.016999s, 435307856 KB] g=15, 115 evaluated, 90 expanded
[t=0.017059s, 435307856 KB] New best heuristic value for landmark_sum_heuristic: 11
[t=0.017062s, 435307856 KB] g=16, 117 evaluated, 92 expanded
[t=0.017083s, 435307856 KB] New best heuristic value for landmark_sum_heuristic: 10
[t=0.017085s, 435307856 KB] g=17, 118 evaluated, 93 expanded
[t=0.017127s, 435307856 KB] New best heuristic value for ff: 11
[t=0.017129s, 435307856 KB] g=17, 120 evaluated, 94 expanded
[t=0.017205s, 435307856 KB] New best heuristic value for landmark_sum_heuristic: 9
[t=0.017207s, 435307856 KB] g=20, 123 evaluated, 97 expanded
[t=0.017775s, 435307856 KB] New best heuristic value for landmark_sum_heuristic: 8
[t=0.017779s, 435307856 KB] New best heuristic value for ff: 10
[t=0.017782s, 435307856 KB] g=22, 148 evaluated, 117 expanded
[t=0.017837s, 435307856 KB] New best heuristic value for landmark_sum_heuristic: 7
[t=0.017842s, 435307856 KB] New best heuristic value for ff: 9
[t=0.017844s, 435307856 KB] g=24, 151 evaluated, 119 expanded
[t=0.018270s, 435307856 KB] New best heuristic value for landmark_sum_heuristic: 6
[t=0.018272s, 435307856 KB] New best heuristic value for ff: 8
[t=0.018275s, 435307856 KB] g=26, 170 evaluated, 134 expanded
[t=0.018318s, 435307856 KB] New best heuristic value for landmark_sum_heuristic: 5
[t=0.018320s, 435307856 KB] New best heuristic value for ff: 7
[t=0.018323s, 435307856 KB] g=28, 173 evaluated, 136 expanded
[t=0.034709s, 435307856 KB] New best heuristic value for landmark_sum_heuristic: 4
[t=0.034720s, 435307856 KB] New best heuristic value for ff: 6
[t=0.034723s, 435307856 KB] g=32, 925 evaluated, 723 expanded
[t=0.251633s, 435307856 KB] New best heuristic value for landmark_sum_heuristic: 3
[t=0.251655s, 435307856 KB] New best heuristic value for ff: 5
[t=0.251660s, 435307856 KB] g=40, 10526 evaluated, 8459 expanded
[t=0.251686s, 435307856 KB] New best heuristic value for landmark_sum_heuristic: 2
[t=0.251689s, 435307856 KB] New best heuristic value for ff: 4
[t=0.251692s, 435307856 KB] g=41, 10527 evaluated, 8460 expanded
[t=0.251716s, 435307856 KB] New best heuristic value for ff: 3
[t=0.251720s, 435307856 KB] g=42, 10528 evaluated, 8461 expanded
[t=0.251750s, 435307856 KB] New best heuristic value for ff: 2
[t=0.251753s, 435307856 KB] g=43, 10529 evaluated, 8462 expanded
[t=0.251781s, 435307856 KB] New best heuristic value for landmark_sum_heuristic: 1
[t=0.251784s, 435307856 KB] New best heuristic value for ff: 1
[t=0.251786s, 435307856 KB] g=44, 10530 evaluated, 8463 expanded
[t=0.251803s, 435307856 KB] Solution found!
[t=0.251808s, 435307856 KB] Actual search time: 0.237827s
move firelink burg (1)
move burg parish (1)
open-shortcut parish firelink (1)
pick-up-key crest-of-artorias parish (1)
move parish darkroot (1)
unlock-door crest-of-artorias darkroot boss-arena (1)
pick-up-titanite darkroot (1)
move darkroot parish (1)
upgrade-weapon parish w0 w1 (1)
move parish roof (1)
attack-boss gargoyles roof hp2 hp1 bp2 bp1 (1)
drink-estus e1 hp1 hp2 hp2 (1)
attack-boss gargoyles roof hp2 hp1 bp1 bp0 (1)
kill-boss gargoyles roof w1 e3 bp0 (1)
move roof parish (1)
move parish firelink (1)
deposit-soul gargoyles firelink (1)
drink-estus e3 hp1 hp2 hp2 (1)
move firelink parish (1)
attack-minor balder-knight parish hp2 hp1 (1)
execute-enemy balder-knight parish s0 s1 (1)
rest parish (1)
attack-minor balder-knight parish hp2 hp1 (1)
execute-enemy balder-knight parish s1 s2 (1)
rest parish (1)
attack-minor balder-knight parish hp2 hp1 (1)
execute-enemy balder-knight parish s2 s3 (1)
level-up-stats parish pl0 pl1 hp2 hp3 s3 s2 (1)
level-up-stats parish pl1 pl2 hp3 hp4 s2 s0 (1)
move parish darkroot (1)
move darkroot boss-arena (1)
attack-boss sif boss-arena hp4 hp3 bp6 bp5 (1)
attack-boss sif boss-arena hp3 hp2 bp5 bp4 (1)
attack-boss sif boss-arena hp2 hp1 bp4 bp3 (1)
drink-estus e3 hp1 hp2 hp4 (1)
attack-boss sif boss-arena hp2 hp1 bp3 bp2 (1)
drink-estus e1 hp1 hp2 hp4 (1)
attack-boss sif boss-arena hp2 hp1 bp2 bp1 (1)
drink-estus e2 hp1 hp2 hp4 (1)
attack-boss sif boss-arena hp2 hp1 bp1 bp0 (1)
kill-boss sif boss-arena w1 e4 bp0 (1)
move boss-arena darkroot (1)
move darkroot parish (1)
move parish firelink (1)
deposit-soul sif firelink (1)
[t=0.252117s, 435307856 KB] Plan length: 45 step(s).
[t=0.252121s, 435307856 KB] Plan cost: 45
[t=0.252124s, 435307856 KB] Expanded 8464 state(s).
[t=0.252126s, 435307856 KB] Reopened 0 state(s).
[t=0.252128s, 435307856 KB] Evaluated 10531 state(s).
[t=0.252130s, 435307856 KB] Evaluations: 18996
[t=0.252133s, 435307856 KB] Generated 23299 state(s).
[t=0.252135s, 435307856 KB] Dead ends: 2066 state(s).
[t=0.252137s, 435307856 KB] Number of registered states: 10531
[t=0.252139s, 435307856 KB] Int hash set load factor: 10531/16384 = 0.642761
[t=0.252142s, 435307856 KB] Int hash set resizes: 14
[t=0.252144s, 435307856 KB] Best solution cost so far: 45
[t=0.252146s, 435307856 KB] Solution found - keep searching
[t=0.252189s, 435307856 KB] Building successor generator...done!
[t=0.252194s, 435307856 KB] peak memory difference for successor generator creation: 0 KB
[t=0.252196s, 435307856 KB] time for successor generation creation: 0.000000s
[t=0.252199s, 435307856 KB] Variables: 38
[t=0.252202s, 435307856 KB] FactPairs: 101
[t=0.252204s, 435307856 KB] Bytes per state: 8
[t=0.252209s, 435307856 KB] Starting search: lazy_wastar
[t=0.252212s, 435307856 KB] Conducting lazy best first search, (real) bound = 45
[t=0.252254s, 435307856 KB] New best heuristic value for landmark_sum_heuristic: 22
[t=0.252258s, 435307856 KB] New best heuristic value for ff: 21
[t=0.252260s, 435307856 KB] g=0, 1 evaluated, 0 expanded
[t=0.252265s, 435307856 KB] Initial heuristic value for landmark_sum_heuristic: 22
[t=0.252267s, 435307856 KB] Initial heuristic value for ff: 21
[t=0.252297s, 435307856 KB] New best heuristic value for landmark_sum_heuristic: 21
[t=0.252300s, 435307856 KB] g=1, 2 evaluated, 1 expanded
[t=0.252387s, 435307856 KB] New best heuristic value for ff: 20
[t=0.252391s, 435307856 KB] g=3, 4 evaluated, 3 expanded
[t=0.252432s, 435307856 KB] New best heuristic value for landmark_sum_heuristic: 20
[t=0.252435s, 435307856 KB] New best heuristic value for ff: 19
[t=0.252437s, 435307856 KB] g=4, 5 evaluated, 4 expanded
[t=0.252505s, 435307856 KB] New best heuristic value for landmark_sum_heuristic: 19
[t=0.252508s, 435307856 KB] g=5, 7 evaluated, 6 expanded
[t=0.252537s, 435307856 KB] New best heuristic value for landmark_sum_heuristic: 18
[t=0.252539s, 435307856 KB] New best heuristic value for ff: 18
[t=0.252541s, 435307856 KB] g=6, 8 evaluated, 7 expanded
[t=0.252581s, 435307856 KB] New best heuristic value for landmark_sum_heuristic: 17
[t=0.252584s, 435307856 KB] New best heuristic value for ff: 17
[t=0.252586s, 435307856 KB] g=7, 10 evaluated, 8 expanded
[t=0.252717s, 435307856 KB] New best heuristic value for landmark_sum_heuristic: 16
[t=0.252720s, 435307856 KB] New best heuristic value for ff: 16
[t=0.252722s, 435307856 KB] g=9, 14 evaluated, 11 expanded
[t=0.252810s, 435307856 KB] New best heuristic value for landmark_sum_heuristic: 15
[t=0.252813s, 435307856 KB] g=10, 17 evaluated, 14 expanded
[t=0.252841s, 435307856 KB] New best heuristic value for landmark_sum_heuristic: 14
[t=0.252844s, 435307856 KB] New best heuristic value for ff: 15
[t=0.252846s, 435307856 KB] g=11, 18 evaluated, 15 expanded
[t=0.255179s, 435307856 KB] New best heuristic value for landmark_sum_heuristic: 13
[t=0.255181s, 435307856 KB] g=12, 113 evaluated, 88 expanded
[t=0.255212s, 435307856 KB] New best heuristic value for landmark_sum_heuristic: 12
[t=0.255214s, 435307856 KB] New best heuristic value for ff: 14
[t=0.255217s, 435307856 KB] g=13, 114 evaluated, 89 expanded
[t=0.255253s, 435307856 KB] New best heuristic value for ff: 13
[t=0.255255s, 435307856 KB] g=14, 115 evaluated, 90 expanded
[t=0.255311s, 435307856 KB] New best heuristic value for landmark_sum_heuristic: 11
[t=0.255314s, 435307856 KB] g=15, 117 evaluated, 92 expanded
[t=0.255334s, 435307856 KB] New best heuristic value for landmark_sum_heuristic: 10
[t=0.255337s, 435307856 KB] g=16, 118 evaluated, 93 expanded
[t=0.255413s, 435307856 KB] New best heuristic value for ff: 12
[t=0.255416s, 435307856 KB] g=17, 121 evaluated, 95 expanded
[t=0.255520s, 435307856 KB] New best heuristic value for landmark_sum_heuristic: 9
[t=0.255523s, 435307856 KB] g=21, 125 evaluated, 99 expanded
[t=0.256334s, 435307856 KB] New best heuristic value for landmark_sum_heuristic: 8
[t=0.256340s, 435307856 KB] New best heuristic value for ff: 11
[t=0.256342s, 435307856 KB] g=23, 158 evaluated, 127 expanded
[t=0.256388s, 435307856 KB] New best heuristic value for landmark_sum_heuristic: 7
[t=0.256391s, 435307856 KB] New best heuristic value for ff: 10
[t=0.256393s, 435307856 KB] g=25, 161 evaluated, 129 expanded
[t=0.256809s, 435307856 KB] New best heuristic value for ff: 9
[t=0.256812s, 435307856 KB] g=26, 180 evaluated, 144 expanded
[t=0.256858s, 435307856 KB] New best heuristic value for landmark_sum_heuristic: 6
[t=0.256861s, 435307856 KB] g=27, 183 evaluated, 146 expanded
[t=0.256905s, 435307856 KB] New best heuristic value for ff: 8
[t=0.256908s, 435307856 KB] g=28, 186 evaluated, 148 expanded
[t=0.256955s, 435307856 KB] New best heuristic value for landmark_sum_heuristic: 5
[t=0.256957s, 435307856 KB] g=29, 189 evaluated, 150 expanded
[t=0.257002s, 435307856 KB] New best heuristic value for ff: 7
[t=0.257004s, 435307856 KB] g=30, 192 evaluated, 152 expanded
[t=0.268095s, 435307856 KB] New best heuristic value for landmark_sum_heuristic: 4
[t=0.268101s, 435307856 KB] New best heuristic value for ff: 6
[t=0.268104s, 435307856 KB] g=34, 776 evaluated, 585 expanded
[t=0.939136s, 435307856 KB] New best heuristic value for landmark_sum_heuristic: 3
[t=0.939151s, 435307856 KB] New best heuristic value for ff: 5
[t=0.939154s, 435307856 KB] g=40, 33265 evaluated, 27622 expanded, 5196 reopened
[t=0.939179s, 435307856 KB] New best heuristic value for landmark_sum_heuristic: 2
[t=0.939183s, 435307856 KB] New best heuristic value for ff: 4
[t=0.939186s, 435307856 KB] g=41, 33266 evaluated, 27623 expanded, 5196 reopened
[t=0.939207s, 435307856 KB] New best heuristic value for ff: 3
[t=0.939210s, 435307856 KB] g=42, 33267 evaluated, 27624 expanded, 5196 reopened
[t=0.939240s, 435307856 KB] New best heuristic value for ff: 2
[t=0.939246s, 435307856 KB] g=43, 33268 evaluated, 27625 expanded, 5196 reopened
[t=0.939277s, 435307856 KB] New best heuristic value for landmark_sum_heuristic: 1
[t=0.939280s, 435307856 KB] New best heuristic value for ff: 1
[t=0.939282s, 435307856 KB] g=44, 33269 evaluated, 27626 expanded, 5196 reopened
[t=1.380724s, 435307856 KB] Solution found!
[t=1.380735s, 435307856 KB] Actual search time: 1.128521s
move firelink burg (1)
move burg parish (1)
pick-up-key crest-of-artorias parish (1)
move parish darkroot (1)
unlock-door crest-of-artorias darkroot boss-arena (1)
pick-up-titanite darkroot (1)
move darkroot parish (1)
upgrade-weapon parish w0 w1 (1)
move parish roof (1)
attack-boss gargoyles roof hp2 hp1 bp2 bp1 (1)
drink-estus e1 hp1 hp2 hp2 (1)
attack-boss gargoyles roof hp2 hp1 bp1 bp0 (1)
kill-boss gargoyles roof w1 e3 bp0 (1)
move roof parish (1)
open-shortcut parish firelink (1)
drink-estus e3 hp1 hp2 hp2 (1)
attack-minor balder-knight parish hp2 hp1 (1)
execute-enemy balder-knight parish s0 s1 (1)
rest parish (1)
attack-minor balder-knight parish hp2 hp1 (1)
execute-enemy balder-knight parish s1 s2 (1)
rest parish (1)
attack-minor balder-knight parish hp2 hp1 (1)
execute-enemy balder-knight parish s2 s3 (1)
level-up-stats parish pl0 pl1 hp2 hp3 s3 s2 (1)
level-up-stats parish pl1 pl2 hp3 hp4 s2 s0 (1)
move parish darkroot (1)
move darkroot boss-arena (1)
attack-boss sif boss-arena hp4 hp3 bp6 bp5 (1)
attack-boss sif boss-arena hp3 hp2 bp5 bp4 (1)
attack-boss sif boss-arena hp2 hp1 bp4 bp3 (1)
drink-estus e3 hp1 hp2 hp4 (1)
attack-boss sif boss-arena hp2 hp1 bp3 bp2 (1)
drink-estus e1 hp1 hp2 hp4 (1)
attack-boss sif boss-arena hp2 hp1 bp2 bp1 (1)
drink-estus e2 hp1 hp2 hp4 (1)
attack-boss sif boss-arena hp2 hp1 bp1 bp0 (1)
kill-boss sif boss-arena w1 e4 bp0 (1)
move boss-arena darkroot (1)
move darkroot parish (1)
move parish firelink (1)
deposit-soul gargoyles firelink (1)
deposit-soul sif firelink (1)
[t=1.381041s, 435307856 KB] Plan length: 43 step(s).
[t=1.381045s, 435307856 KB] Plan cost: 43
[t=1.381048s, 435307856 KB] Expanded 44600 state(s).
[t=1.381050s, 435307856 KB] Reopened 8834 state(s).
[t=1.381052s, 435307856 KB] Evaluated 53135 state(s).
[t=1.381054s, 435307856 KB] Evaluations: 88902
[t=1.381057s, 435307856 KB] Generated 132149 state(s).
[t=1.381059s, 435307856 KB] Dead ends: 8534 state(s).
[t=1.381061s, 435307856 KB] Number of registered states: 44301
[t=1.381063s, 435307856 KB] Int hash set load factor: 44301/65536 = 0.675980
[t=1.381066s, 435307856 KB] Int hash set resizes: 16
[t=1.381068s, 435307856 KB] Best solution cost so far: 43
[t=1.381070s, 435307856 KB] Solution found - keep searching
[t=1.381126s, 435307856 KB] Building successor generator...done!
[t=1.381131s, 435307856 KB] peak memory difference for successor generator creation: 0 KB
[t=1.381134s, 435307856 KB] time for successor generation creation: 0.000000s
[t=1.381137s, 435307856 KB] Variables: 38
[t=1.381139s, 435307856 KB] FactPairs: 101
[t=1.381141s, 435307856 KB] Bytes per state: 8
[t=1.381147s, 435307856 KB] Starting search: lazy_wastar
[t=1.381149s, 435307856 KB] Conducting lazy best first search, (real) bound = 43
[t=1.381199s, 435307856 KB] New best heuristic value for landmark_sum_heuristic: 22
[t=1.381201s, 435307856 KB] New best heuristic value for ff: 21
[t=1.381204s, 435307856 KB] g=0, 1 evaluated, 0 expanded
[t=1.381210s, 435307856 KB] Initial heuristic value for landmark_sum_heuristic: 22
[t=1.381212s, 435307856 KB] Initial heuristic value for ff: 21
[t=1.381248s, 435307856 KB] New best heuristic value for landmark_sum_heuristic: 21
[t=1.381251s, 435307856 KB] g=1, 2 evaluated, 1 expanded
[t=1.381332s, 435307856 KB] New best heuristic value for ff: 20
[t=1.381339s, 435307856 KB] g=3, 4 evaluated, 3 expanded
[t=1.381380s, 435307856 KB] New best heuristic value for landmark_sum_heuristic: 20
[t=1.381382s, 435307856 KB] New best heuristic value for ff: 19
[t=1.381384s, 435307856 KB] g=4, 5 evaluated, 4 expanded
[t=1.381452s, 435307856 KB] New best heuristic value for landmark_sum_heuristic: 19
[t=1.381454s, 435307856 KB] g=5, 7 evaluated, 6 expanded
[t=1.381483s, 435307856 KB] New best heuristic value for landmark_sum_heuristic: 18
[t=1.381486s, 435307856 KB] New best heuristic value for ff: 18
[t=1.381488s, 435307856 KB] g=6, 8 evaluated, 7 expanded
[t=1.381528s, 435307856 KB] New best heuristic value for landmark_sum_heuristic: 17
[t=1.381530s, 435307856 KB] New best heuristic value for ff: 17
[t=1.381532s, 435307856 KB] g=7, 10 evaluated, 8 expanded
[t=1.381655s, 435307856 KB] New best heuristic value for landmark_sum_heuristic: 16
[t=1.381657s, 435307856 KB] New best heuristic value for ff: 16
[t=1.381665s, 435307856 KB] g=9, 14 evaluated, 11 expanded
[t=1.381754s, 435307856 KB] New best heuristic value for landmark_sum_heuristic: 15
[t=1.381756s, 435307856 KB] g=10, 17 evaluated, 14 expanded
[t=1.381784s, 435307856 KB] New best heuristic value for landmark_sum_heuristic: 14
[t=1.381786s, 435307856 KB] New best heuristic value for ff: 15
[t=1.381788s, 435307856 KB] g=11, 18 evaluated, 15 expanded
[t=1.384106s, 435307856 KB] New best heuristic value for landmark_sum_heuristic: 13
[t=1.384109s, 435307856 KB] g=12, 113 evaluated, 88 expanded
[t=1.384139s, 435307856 KB] New best heuristic value for landmark_sum_heuristic: 12
[t=1.384141s, 435307856 KB] New best heuristic value for ff: 14
[t=1.384143s, 435307856 KB] g=13, 114 evaluated, 89 expanded
[t=1.384179s, 435307856 KB] New best heuristic value for ff: 13
[t=1.384181s, 435307856 KB] g=14, 115 evaluated, 90 expanded
[t=1.384237s, 435307856 KB] New best heuristic value for landmark_sum_heuristic: 11
[t=1.384239s, 435307856 KB] g=15, 117 evaluated, 92 expanded
[t=1.384260s, 435307856 KB] New best heuristic value for landmark_sum_heuristic: 10
[t=1.384262s, 435307856 KB] g=16, 118 evaluated, 93 expanded
[t=1.384669s, 435307856 KB] New best heuristic value for ff: 12
[t=1.384674s, 435307856 KB] g=17, 135 evaluated, 107 expanded
[t=1.384958s, 435307856 KB] New best heuristic value for landmark_sum_heuristic: 9
[t=1.384961s, 435307856 KB] g=21, 145 evaluated, 117 expanded
[t=1.385227s, 435307856 KB] New best heuristic value for ff: 11
[t=1.385230s, 435307856 KB] g=17, 158 evaluated, 126 expanded
[t=1.385498s, 435307856 KB] New best heuristic value for landmark_sum_heuristic: 8
[t=1.385501s, 435307856 KB] New best heuristic value for ff: 10
[t=1.385503s, 435307856 KB] g=22, 170 evaluated, 136 expanded
[t=1.386757s, 435307856 KB] New best heuristic value for landmark_sum_heuristic: 7
[t=1.386760s, 435307856 KB] New best heuristic value for ff: 9
[t=1.386762s, 435307856 KB] g=24, 234 evaluated, 184 expanded
[t=1.386916s, 435307856 KB] New best heuristic value for landmark_sum_heuristic: 6
[t=1.386918s, 435307856 KB] New best heuristic value for ff: 8
[t=1.386921s, 435307856 KB] g=26, 242 evaluated, 190 expanded
[t=1.386963s, 435307856 KB] New best heuristic value for landmark_sum_heuristic: 5
[t=1.386965s, 435307856 KB] New best heuristic value for ff: 7
[t=1.386967s, 435307856 KB] g=28, 245 evaluated, 192 expanded
[t=1.412715s, 435307856 KB] New best heuristic value for landmark_sum_heuristic: 4
[t=1.412737s, 435307856 KB] New best heuristic value for ff: 6
[t=1.412742s, 435307856 KB] g=32, 1472 evaluated, 1151 expanded, 48 reopened
[t=2.533361s, 435307856 KB] New best heuristic value for landmark_sum_heuristic: 3
[t=2.533394s, 435307856 KB] New best heuristic value for ff: 5
[t=2.533399s, 435307856 KB] g=38, 50197 evaluated, 42327 expanded, 7517 reopened
[t=2.533430s, 435307856 KB] New best heuristic value for landmark_sum_heuristic: 2
[t=2.533434s, 435307856 KB] New best heuristic value for ff: 4
[t=2.533437s, 435307856 KB] g=39, 50198 evaluated, 42328 expanded, 7517 reopened
[t=2.533460s, 435307856 KB] New best heuristic value for ff: 3
[t=2.533463s, 435307856 KB] g=40, 50199 evaluated, 42329 expanded, 7517 reopened
[t=2.533493s, 435307856 KB] New best heuristic value for ff: 2
[t=2.533496s, 435307856 KB] g=41, 50200 evaluated, 42330 expanded, 7517 reopened
[t=2.533525s, 435307856 KB] New best heuristic value for landmark_sum_heuristic: 1
[t=2.533528s, 435307856 KB] New best heuristic value for ff: 1
[t=2.533531s, 435307856 KB] g=42, 50201 evaluated, 42331 expanded, 7517 reopened
[t=2.797956s, 435307856 KB] Solution found!
[t=2.797972s, 435307856 KB] Actual search time: 1.416820s
move firelink burg (1)
move burg parish (1)
open-shortcut parish firelink (1)
pick-up-key crest-of-artorias parish (1)
move parish darkroot (1)
unlock-door crest-of-artorias darkroot boss-arena (1)
pick-up-titanite darkroot (1)
move darkroot parish (1)
upgrade-weapon parish w0 w1 (1)
attack-minor balder-knight parish hp2 hp1 (1)
execute-enemy balder-knight parish s0 s1 (1)
level-up-stats parish pl0 pl1 hp2 hp3 s1 s0 (1)
move parish roof (1)
attack-boss gargoyles roof hp3 hp2 bp2 bp1 (1)
attack-boss gargoyles roof hp2 hp1 bp1 bp0 (1)
kill-boss gargoyles roof w1 e3 bp0 (1)
move roof parish (1)
rest parish (1)
attack-minor balder-knight parish hp3 hp2 (1)
execute-enemy balder-knight parish s0 s1 (1)
rest parish (1)
attack-minor balder-knight parish hp3 hp2 (1)
execute-enemy balder-knight parish s1 s2 (1)
level-up-stats parish pl1 pl2 hp3 hp4 s2 s0 (1)
move parish darkroot (1)
move darkroot boss-arena (1)
attack-boss sif boss-arena hp4 hp3 bp6 bp5 (1)
attack-boss sif boss-arena hp3 hp2 bp5 bp4 (1)
attack-boss sif boss-arena hp2 hp1 bp4 bp3 (1)
drink-estus e3 hp1 hp2 hp4 (1)
attack-boss sif boss-arena hp2 hp1 bp3 bp2 (1)
drink-estus e1 hp1 hp2 hp4 (1)
attack-boss sif boss-arena hp2 hp1 bp2 bp1 (1)
drink-estus e2 hp1 hp2 hp4 (1)
attack-boss sif boss-arena hp2 hp1 bp1 bp0 (1)
kill-boss sif boss-arena w1 e4 bp0 (1)
move boss-arena darkroot (1)
move darkroot parish (1)
move parish firelink (1)
deposit-soul gargoyles firelink (1)
deposit-soul sif firelink (1)
[t=2.798305s, 435307856 KB] Plan length: 41 step(s).
[t=2.798309s, 435307856 KB] Plan cost: 41
[t=2.798312s, 435307856 KB] Expanded 51715 state(s).
[t=2.798315s, 435307856 KB] Reopened 9327 state(s).
[t=2.798317s, 435307856 KB] Evaluated 61073 state(s).
[t=2.798320s, 435307856 KB] Evaluations: 103462
[t=2.798322s, 435307856 KB] Generated 166366 state(s).
[t=2.798324s, 435307856 KB] Dead ends: 9357 state(s).
[t=2.798327s, 435307856 KB] Number of registered states: 51746
[t=2.798329s, 435307856 KB] Int hash set load factor: 51746/65536 = 0.789581
[t=2.798332s, 435307856 KB] Int hash set resizes: 16
[t=2.798334s, 435307856 KB] Best solution cost so far: 41
[t=2.798337s, 435307856 KB] Solution found - keep searching
[t=2.798399s, 435307856 KB] Building successor generator...done!
[t=2.798404s, 435307856 KB] peak memory difference for successor generator creation: 0 KB
[t=2.798406s, 435307856 KB] time for successor generation creation: 0.000000s
[t=2.798409s, 435307856 KB] Variables: 38
[t=2.798412s, 435307856 KB] FactPairs: 101
[t=2.798414s, 435307856 KB] Bytes per state: 8
[t=2.798420s, 435307856 KB] Starting search: lazy_wastar
[t=2.798422s, 435307856 KB] Conducting lazy best first search, (real) bound = 41
[t=2.798464s, 435307856 KB] New best heuristic value for landmark_sum_heuristic: 22
[t=2.798466s, 435307856 KB] New best heuristic value for ff: 21
[t=2.798468s, 435307856 KB] g=0, 1 evaluated, 0 expanded
[t=2.798473s, 435307856 KB] Initial heuristic value for landmark_sum_heuristic: 22
[t=2.798475s, 435307856 KB] Initial heuristic value for ff: 21
[t=2.798505s, 435307856 KB] New best heuristic value for landmark_sum_heuristic: 21
[t=2.798507s, 435307856 KB] g=1, 2 evaluated, 1 expanded
[t=2.798591s, 435307856 KB] New best heuristic value for ff: 20
[t=2.798598s, 435307856 KB] g=3, 4 evaluated, 3 expanded
[t=2.798639s, 435307856 KB] New best heuristic value for landmark_sum_heuristic: 20
[t=2.798641s, 435307856 KB] New best heuristic value for ff: 19
[t=2.798644s, 435307856 KB] g=4, 5 evaluated, 4 expanded
[t=2.798751s, 435307856 KB] New best heuristic value for landmark_sum_heuristic: 19
[t=2.798753s, 435307856 KB] g=5, 8 evaluated, 7 expanded
[t=2.798836s, 435307856 KB] New best heuristic value for landmark_sum_heuristic: 18
[t=2.798839s, 435307856 KB] g=5, 11 evaluated, 10 expanded
[t=2.798939s, 435307856 KB] New best heuristic value for landmark_sum_heuristic: 17
[t=2.798942s, 435307856 KB] New best heuristic value for ff: 18
[t=2.798944s, 435307856 KB] g=6, 15 evaluated, 13 expanded
[t=2.799093s, 435307856 KB] New best heuristic value for ff: 17
[t=2.799096s, 435307856 KB] g=8, 20 evaluated, 17 expanded
[t=2.799170s, 435307856 KB] New best heuristic value for landmark_sum_heuristic: 16
[t=2.799173s, 435307856 KB] g=8, 22 evaluated, 19 expanded
[t=2.799214s, 435307856 KB] New best heuristic value for ff: 16
[t=2.799217s, 435307856 KB] g=9, 23 evaluated, 20 expanded
[t=2.799332s, 435307856 KB] New best heuristic value for landmark_sum_heuristic: 15
[t=2.799342s, 435307856 KB] g=9, 27 evaluated, 24 expanded
[t=2.799398s, 435307856 KB] New best heuristic value for landmark_sum_heuristic: 14
[t=2.799400s, 435307856 KB] g=10, 29 evaluated, 26 expanded
[t=2.799490s, 435307856 KB] New best heuristic value for ff: 15
[t=2.799493s, 435307856 KB] g=11, 33 evaluated, 29 expanded
[t=2.801445s, 435307856 KB] New best heuristic value for landmark_sum_heuristic: 13
[t=2.801451s, 435307856 KB] g=12, 114 evaluated, 89 expanded, 1 reopened
[t=2.801483s, 435307856 KB] New best heuristic value for landmark_sum_heuristic: 12
[t=2.801485s, 435307856 KB] New best heuristic value for ff: 14
[t=2.801488s, 435307856 KB] g=13, 115 evaluated, 90 expanded, 1 reopened
[t=2.801526s, 435307856 KB] New best heuristic value for ff: 13
[t=2.801528s, 435307856 KB] g=14, 116 evaluated, 91 expanded, 1 reopened
[t=2.801615s, 435307856 KB] New best heuristic value for landmark_sum_heuristic: 11
[t=2.801618s, 435307856 KB] g=15, 119 evaluated, 94 expanded, 1 reopened
[t=2.801704s, 435307856 KB] New best heuristic value for landmark_sum_heuristic: 10
[t=2.801706s, 435307856 KB] g=16, 122 evaluated, 97 expanded, 1 reopened
[t=2.802053s, 435307856 KB] New best heuristic value for ff: 12
[t=2.802056s, 435307856 KB] g=17, 136 evaluated, 108 expanded, 1 reopened
[t=2.802360s, 435307856 KB] New best heuristic value for landmark_sum_heuristic: 9
[t=2.802366s, 435307856 KB] g=21, 146 evaluated, 118 expanded, 1 reopened
[t=2.802630s, 435307856 KB] New best heuristic value for ff: 11
[t=2.802633s, 435307856 KB] g=17, 159 evaluated, 127 expanded, 1 reopened
[t=2.803039s, 435307856 KB] New best heuristic value for landmark_sum_heuristic: 8
[t=2.803042s, 435307856 KB] New best heuristic value for ff: 10
[t=2.803044s, 435307856 KB] g=22, 177 evaluated, 142 expanded, 1 reopened
[t=2.806076s, 435307856 KB] New best heuristic value for landmark_sum_heuristic: 7
[t=2.806079s, 435307856 KB] g=22, 318 evaluated, 253 expanded, 1 reopened
[t=2.806535s, 435307856 KB] New best heuristic value for landmark_sum_heuristic: 6
[t=2.806541s, 435307856 KB] New best heuristic value for ff: 9
[t=2.806543s, 435307856 KB] g=24, 339 evaluated, 270 expanded, 1 reopened
[t=2.814285s, 435307856 KB] New best heuristic value for ff: 8
[t=2.814291s, 435307856 KB] g=25, 679 evaluated, 535 expanded, 1 reopened
[t=2.822955s, 435307856 KB] New best heuristic value for landmark_sum_heuristic: 5
[t=2.822965s, 435307856 KB] New best heuristic value for ff: 7
[t=2.822968s, 435307856 KB] g=28, 1049 evaluated, 827 expanded, 10 reopened
[t=2.929651s, 435307856 KB] New best heuristic value for landmark_sum_heuristic: 4
[t=2.929663s, 435307856 KB] New best heuristic value for ff: 6
[t=2.929666s, 435307856 KB] g=32, 5143 evaluated, 4216 expanded, 130 reopened
[t=9.071933s, 435307856 KB] New best heuristic value for landmark_sum_heuristic: 3
[t=9.071958s, 435307856 KB] g=38, 224063 evaluated, 199161 expanded, 22646 reopened
[t=9.071986s, 435307856 KB] New best heuristic value for landmark_sum_heuristic: 2
[t=9.071990s, 435307856 KB] New best heuristic value for ff: 5
[t=9.071994s, 435307856 KB] g=39, 224064 evaluated, 199162 expanded, 22646 reopened
[t=9.072017s, 435307856 KB] New best heuristic value for ff: 4
[t=9.072020s, 435307856 KB] g=40, 224065 evaluated, 199163 expanded, 22646 reopened
[t=9.084888s, 435307856 KB] New best heuristic value for ff: 3
[t=9.084896s, 435307856 KB] g=38, 224591 evaluated, 199622 expanded, 22671 reopened
[t=9.084941s, 435307856 KB] New best heuristic value for ff: 2
[t=9.084944s, 435307856 KB] g=39, 224593 evaluated, 199624 expanded, 22671 reopened
[t=9.084971s, 435307856 KB] New best heuristic value for landmark_sum_heuristic: 1
[t=9.084974s, 435307856 KB] New best heuristic value for ff: 1
[t=9.084976s, 435307856 KB] g=40, 224594 evaluated, 199625 expanded, 22671 reopened
[t=97.926831s, 435341136 KB] Completely explored state space -- no solution!
[t=97.926885s, 435341136 KB] Actual search time: 95.128461s
[t=97.926892s, 435341136 KB] Expanded 2759193 state(s).
[t=97.926897s, 435341136 KB] Reopened 569435 state(s).
[t=97.926909s, 435341136 KB] Evaluated 2932838 state(s).
[t=97.926913s, 435341136 KB] Evaluations: 5122596
[t=97.926916s, 435341136 KB] Generated 11287540 state(s).
[t=97.926919s, 435341136 KB] Dead ends: 173645 state(s).
[t=97.926922s, 435341136 KB] Number of registered states: 2363403
[t=97.926925s, 435341136 KB] Int hash set load factor: 2363403/4194304 = 0.563479
[t=97.926928s, 435341136 KB] Int hash set resizes: 22
[t=97.926931s, 435341136 KB] Best solution cost so far: 41
[t=97.926933s, 435341136 KB] No solution found - keep searching
[t=97.927322s, 435341136 KB] Building successor generator...done!
[t=97.927330s, 435341136 KB] peak memory difference for successor generator creation: 0 KB
[t=97.927334s, 435341136 KB] time for successor generation creation: 0.000000s
[t=97.927337s, 435341136 KB] Variables: 38
[t=97.927340s, 435341136 KB] FactPairs: 101
[t=97.927343s, 435341136 KB] Bytes per state: 8
[t=97.927351s, 435341136 KB] Starting search: lazy_wastar
[t=97.927355s, 435341136 KB] Conducting lazy best first search, (real) bound = 41
[t=97.927406s, 435341136 KB] New best heuristic value for landmark_sum_heuristic: 22
[t=97.927409s, 435341136 KB] New best heuristic value for ff: 21
[t=97.927411s, 435341136 KB] g=0, 1 evaluated, 0 expanded
[t=97.927417s, 435341136 KB] Initial heuristic value for landmark_sum_heuristic: 22
[t=97.927420s, 435341136 KB] Initial heuristic value for ff: 21
[t=97.927450s, 435341136 KB] New best heuristic value for landmark_sum_heuristic: 21
[t=97.927453s, 435341136 KB] g=1, 2 evaluated, 1 expanded
[t=97.927532s, 435341136 KB] New best heuristic value for ff: 20
[t=97.927535s, 435341136 KB] g=3, 4 evaluated, 3 expanded
[t=97.927575s, 435341136 KB] New best heuristic value for landmark_sum_heuristic: 20
[t=97.927578s, 435341136 KB] g=3, 5 evaluated, 4 expanded
[t=97.927670s, 435341136 KB] New best heuristic value for ff: 19
[t=97.927673s, 435341136 KB] g=4, 8 evaluated, 7 expanded
[t=97.927738s, 435341136 KB] New best heuristic value for landmark_sum_heuristic: 19
[t=97.927741s, 435341136 KB] g=4, 10 evaluated, 9 expanded
[t=97.927897s, 435341136 KB] New best heuristic value for landmark_sum_heuristic: 18
[t=97.927900s, 435341136 KB] g=5, 16 evaluated, 15 expanded
[t=97.928139s, 435341136 KB] New best heuristic value for landmark_sum_heuristic: 17
[t=97.928142s, 435341136 KB] New best heuristic value for ff: 18
[t=97.928144s, 435341136 KB] g=6, 25 evaluated, 22 expanded
[t=97.928577s, 435341136 KB] New best heuristic value for ff: 17
[t=97.928580s, 435341136 KB] g=7, 41 evaluated, 34 expanded
[t=97.928846s, 435341136 KB] New best heuristic value for landmark_sum_heuristic: 16
[t=97.928848s, 435341136 KB] g=8, 50 evaluated, 41 expanded
[t=97.929165s, 435341136 KB] New best heuristic value for ff: 16
[t=97.929168s, 435341136 KB] g=9, 60 evaluated, 51 expanded
[t=97.929221s, 435341136 KB] New best heuristic value for landmark_sum_heuristic: 15
[t=97.929224s, 435341136 KB] g=9, 62 evaluated, 53 expanded
[t=97.929319s, 435341136 KB] New best heuristic value for landmark_sum_heuristic: 14
[t=97.929322s, 435341136 KB] g=10, 65 evaluated, 56 expanded
[t=97.930079s, 435341136 KB] New best heuristic value for ff: 15
[t=97.930083s, 435341136 KB] g=11, 96 evaluated, 81 expanded
[t=97.936093s, 435341136 KB] New best heuristic value for landmark_sum_heuristic: 13
[t=97.936096s, 435341136 KB] New best heuristic value for ff: 14
[t=97.936099s, 435341136 KB] g=12, 331 evaluated, 260 expanded, 1 reopened
[t=97.937227s, 435341136 KB] New best heuristic value for landmark_sum_heuristic: 12
[t=97.937229s, 435341136 KB] New best heuristic value for ff: 13
[t=97.937232s, 435341136 KB] g=14, 369 evaluated, 293 expanded, 1 reopened
[t=97.937847s, 435341136 KB] New best heuristic value for landmark_sum_heuristic: 11
[t=97.937850s, 435341136 KB] g=15, 391 evaluated, 315 expanded, 1 reopened
[t=97.938061s, 435341136 KB] New best heuristic value for landmark_sum_heuristic: 10
[t=97.938064s, 435341136 KB] g=16, 399 evaluated, 323 expanded, 1 reopened
[t=97.939354s, 435341136 KB] New best heuristic value for ff: 12
[t=97.939361s, 435341136 KB] g=17, 440 evaluated, 361 expanded, 1 reopened
[t=97.941932s, 435341136 KB] New best heuristic value for landmark_sum_heuristic: 9
[t=97.941935s, 435341136 KB] g=21, 529 evaluated, 444 expanded, 1 reopened
[t=97.961021s, 435341136 KB] New best heuristic value for ff: 11
[t=97.961029s, 435341136 KB] g=17, 1220 evaluated, 1039 expanded, 1 reopened
[t=97.997976s, 435341136 KB] New best heuristic value for landmark_sum_heuristic: 8
[t=97.997982s, 435341136 KB] g=23, 2646 evaluated, 2248 expanded, 88 reopened
[t=98.017668s, 435341136 KB] New best heuristic value for ff: 10
[t=98.017671s, 435341136 KB] g=22, 3329 evaluated, 2879 expanded, 88 reopened
[t=98.917442s, 435341136 KB] New best heuristic value for landmark_sum_heuristic: 7
[t=98.917457s, 435341136 KB] g=22, 34555 evaluated, 31249 expanded, 1328 reopened
[t=99.658756s, 435341136 KB] New best heuristic value for ff: 9
[t=99.658797s, 435341136 KB] g=23, 58545 evaluated, 53085 expanded, 1644 reopened
[t=99.812624s, 435341136 KB] New best heuristic value for landmark_sum_heuristic: 6
[t=99.812637s, 435341136 KB] g=24, 63783 evaluated, 57672 expanded, 1650 reopened
[t=101.072585s, 435341136 KB] New best heuristic value for ff: 8
[t=101.072606s, 435341136 KB] g=25, 104222 evaluated, 94601 expanded, 2319 reopened
[t=102.908244s, 435341136 KB] New best heuristic value for landmark_sum_heuristic: 5
[t=102.908263s, 435341136 KB] g=27, 163298 evaluated, 148163 expanded, 3752 reopened
[t=105.459827s, 435345232 KB] New best heuristic value for ff: 7
[t=105.459866s, 435345232 KB] g=28, 244193 evaluated, 222283 expanded, 7020 reopened
[t=112.294095s, 435345232 KB] New best heuristic value for landmark_sum_heuristic: 4
[t=112.294135s, 435345232 KB] New best heuristic value for ff: 6
[t=112.294141s, 435345232 KB] g=31, 468895 evaluated, 425944 expanded, 24824 reopened
[t=123.626588s, 435316560 KB] New best heuristic value for landmark_sum_heuristic: 3
[t=123.626635s, 435316560 KB] g=35, 838554 evaluated, 766784 expanded, 74694 reopened
[t=123.626681s, 435316560 KB] New best heuristic value for ff: 5
[t=123.626686s, 435316560 KB] g=36, 838556 evaluated, 766786 expanded, 74694 reopened
[t=123.626736s, 435316560 KB] New best heuristic value for ff: 4
[t=123.626741s, 435316560 KB] g=37, 838558 evaluated, 766788 expanded, 74694 reopened
[t=123.626803s, 435316560 KB] New best heuristic value for ff: 3
[t=123.626808s, 435316560 KB] g=38, 838560 evaluated, 766790 expanded, 74694 reopened
[t=123.626863s, 435316560 KB] New best heuristic value for landmark_sum_heuristic: 2
[t=123.626867s, 435316560 KB] New best heuristic value for ff: 2
[t=123.626870s, 435316560 KB] g=39, 838562 evaluated, 766792 expanded, 74694 reopened
[t=123.626925s, 435316560 KB] New best heuristic value for landmark_sum_heuristic: 1
[t=123.626929s, 435316560 KB] New best heuristic value for ff: 1
[t=123.626932s, 435316560 KB] g=40, 838564 evaluated, 766794 expanded, 74694 reopened
[t=191.569068s, 435341152 KB] Completely explored state space -- no solution!
[t=191.569125s, 435341152 KB] Actual search time: 93.641768s
[t=191.569132s, 435341152 KB] Expanded 2608577 state(s).
[t=191.569140s, 435341152 KB] Reopened 418819 state(s).
[t=191.569144s, 435341152 KB] Evaluated 2782222 state(s).
[t=191.569148s, 435341152 KB] Evaluations: 4971980
[t=191.569152s, 435341152 KB] Generated 10984161 state(s).
[t=191.569156s, 435341152 KB] Dead ends: 173645 state(s).
[t=191.569160s, 435341152 KB] Number of registered states: 2363403
[t=191.569165s, 435341152 KB] Int hash set load factor: 2363403/4194304 = 0.563479
[t=191.569169s, 435341152 KB] Int hash set resizes: 22
[t=191.569172s, 435341152 KB] Best solution cost so far: 41
[t=191.569176s, 435341152 KB] No solution found - keep searching
[t=191.569547s, 435341152 KB] Actual search time: 191.555616s
[t=191.569553s, 435341152 KB] Cumulative statistics:
[t=191.569553s, 435341152 KB] Expanded 5472549 state(s).
[t=191.569553s, 435341152 KB] Reopened 1006415 state(s).
[t=191.569553s, 435341152 KB] Evaluated 5839799 state(s).
[t=191.569553s, 435341152 KB] Evaluations: 10305936
[t=191.569553s, 435341152 KB] Generated 22593515 state(s).
[t=191.569553s, 435341152 KB] Dead ends: 0 state(s).
[t=191.569553s, 435341152 KB] Search time: 191.555621s
[t=191.569553s, 435341152 KB] Total time: 191.569553s
Solution found.
Peak memory: 435341152 KB
Remove intermediate file output.sas
search exit code: 0

INFO     Planner time: 191.71s

=== Experiment Summary ===
End Time: 2025-12-16 11:46:25
Runtime: 192 seconds
Exit Code: 0
Status: SUCCESS
Explanation: SUCCESS (solution found)
